{
  "$id": "relico://frontend/multi-store-payload-v1",
  "$schema": "https://json-schema.org/draft/2020-12/schema",
  "additionalProperties": false,
  "properties": {
    "actorClass": {
      "minLength": 1,
      "type": "string"
    },
    "actorName": {
      "minLength": 1,
      "type": "string"
    },
    "className": {
      "minLength": 1,
      "type": "string"
    },
    "constructorBody": {
      "items": {
        "oneOf": [
          {
            "additionalProperties": false,
            "properties": {
              "expression": {
                "oneOf": [
                  {
                    "additionalProperties": false,
                    "properties": {
                      "kind": {
                        "const": "intLiteral"
                      },
                      "value": {
                        "type": "integer"
                      }
                    },
                    "required": [
                      "kind",
                      "value"
                    ],
                    "type": "object"
                  },
                  {
                    "additionalProperties": false,
                    "properties": {
                      "kind": {
                        "const": "stateVar"
                      },
                      "name": {
                        "minLength": 1,
                        "type": "string"
                      }
                    },
                    "required": [
                      "kind",
                      "name"
                    ],
                    "type": "object"
                  },
                  {
                    "additionalProperties": false,
                    "properties": {
                      "kind": {
                        "const": "parameterVar"
                      },
                      "name": {
                        "minLength": 1,
                        "type": "string"
                      }
                    },
                    "required": [
                      "kind",
                      "name"
                    ],
                    "type": "object"
                  }
                ]
              },
              "kind": {
                "const": "assign"
              },
              "target": {
                "minLength": 1,
                "type": "string"
              }
            },
            "required": [
              "kind",
              "target",
              "expression"
            ],
            "type": "object"
          },
          {
            "additionalProperties": false,
            "properties": {
              "arguments": {
                "items": {
                  "oneOf": [
                    {
                      "additionalProperties": false,
                      "properties": {
                        "kind": {
                          "const": "intLiteral"
                        },
                        "value": {
                          "type": "integer"
                        }
                      },
                      "required": [
                        "kind",
                        "value"
                      ],
                      "type": "object"
                    },
                    {
                      "additionalProperties": false,
                      "properties": {
                        "kind": {
                          "const": "stateVar"
                        },
                        "name": {
                          "minLength": 1,
                          "type": "string"
                        }
                      },
                      "required": [
                        "kind",
                        "name"
                      ],
                      "type": "object"
                    },
                    {
                      "additionalProperties": false,
                      "properties": {
                        "kind": {
                          "const": "parameterVar"
                        },
                        "name": {
                          "minLength": 1,
                          "type": "string"
                        }
                      },
                      "required": [
                        "kind",
                        "name"
                      ],
                      "type": "object"
                    }
                  ]
                },
                "type": "array"
              },
              "delay": {
                "minimum": 0,
                "type": "integer"
              },
              "kind": {
                "const": "selfSend"
              },
              "message": {
                "minLength": 1,
                "type": "string"
              }
            },
            "required": [
              "kind",
              "message",
              "arguments",
              "delay"
            ],
            "type": "object"
          }
        ]
      },
      "type": "array"
    },
    "family": {
      "const": "multiStorePayload"
    },
    "messageServers": {
      "items": {
        "additionalProperties": false,
        "properties": {
          "body": {
            "items": {
              "oneOf": [
                {
                  "additionalProperties": false,
                  "properties": {
                    "expression": {
                      "oneOf": [
                        {
                          "additionalProperties": false,
                          "properties": {
                            "kind": {
                              "const": "intLiteral"
                            },
                            "value": {
                              "type": "integer"
                            }
                          },
                          "required": [
                            "kind",
                            "value"
                          ],
                          "type": "object"
                        },
                        {
                          "additionalProperties": false,
                          "properties": {
                            "kind": {
                              "const": "stateVar"
                            },
                            "name": {
                              "minLength": 1,
                              "type": "string"
                            }
                          },
                          "required": [
                            "kind",
                            "name"
                          ],
                          "type": "object"
                        },
                        {
                          "additionalProperties": false,
                          "properties": {
                            "kind": {
                              "const": "parameterVar"
                            },
                            "name": {
                              "minLength": 1,
                              "type": "string"
                            }
                          },
                          "required": [
                            "kind",
                            "name"
                          ],
                          "type": "object"
                        }
                      ]
                    },
                    "kind": {
                      "const": "assign"
                    },
                    "target": {
                      "minLength": 1,
                      "type": "string"
                    }
                  },
                  "required": [
                    "kind",
                    "target",
                    "expression"
                  ],
                  "type": "object"
                },
                {
                  "additionalProperties": false,
                  "properties": {
                    "arguments": {
                      "items": {
                        "oneOf": [
                          {
                            "additionalProperties": false,
                            "properties": {
                              "kind": {
                                "const": "intLiteral"
                              },
                              "value": {
                                "type": "integer"
                              }
                            },
                            "required": [
                              "kind",
                              "value"
                            ],
                            "type": "object"
                          },
                          {
                            "additionalProperties": false,
                            "properties": {
                              "kind": {
                                "const": "stateVar"
                              },
                              "name": {
                                "minLength": 1,
                                "type": "string"
                              }
                            },
                            "required": [
                              "kind",
                              "name"
                            ],
                            "type": "object"
                          },
                          {
                            "additionalProperties": false,
                            "properties": {
                              "kind": {
                                "const": "parameterVar"
                              },
                              "name": {
                                "minLength": 1,
                                "type": "string"
                              }
                            },
                            "required": [
                              "kind",
                              "name"
                            ],
                            "type": "object"
                          }
                        ]
                      },
                      "type": "array"
                    },
                    "delay": {
                      "minimum": 0,
                      "type": "integer"
                    },
                    "kind": {
                      "const": "selfSend"
                    },
                    "message": {
                      "minLength": 1,
                      "type": "string"
                    }
                  },
                  "required": [
                    "kind",
                    "message",
                    "arguments",
                    "delay"
                  ],
                  "type": "object"
                }
              ]
            },
            "type": "array"
          },
          "name": {
            "minLength": 1,
            "type": "string"
          },
          "parameters": {
            "items": {
              "minLength": 1,
              "type": "string"
            },
            "type": "array"
          },
          "priority": {
            "oneOf": [
              {
                "minimum": 0,
                "type": "integer"
              },
              {
                "type": "null"
              }
            ]
          }
        },
        "required": [
          "name",
          "parameters",
          "body",
          "priority"
        ],
        "type": "object"
      },
      "type": "array"
    },
    "schemaVersion": {
      "const": 1
    },
    "stateVariables": {
      "items": {
        "additionalProperties": false,
        "properties": {
          "initialValue": {
            "type": "integer"
          },
          "name": {
            "minLength": 1,
            "type": "string"
          }
        },
        "required": [
          "name",
          "initialValue"
        ],
        "type": "object"
      },
      "type": "array"
    }
  },
  "required": [
    "schemaVersion",
    "family",
    "className",
    "actorName",
    "actorClass",
    "stateVariables",
    "constructorBody",
    "messageServers"
  ],
  "title": "ReLico multi-store-payload parser bridge v1",
  "type": "object"
}
