{
  "actorClass": "Stepper",
  "actorName": "stepper",
  "className": "Stepper",
  "constructorBody": [
    {
      "expression": {
        "kind": "intLiteral",
        "value": 1
      },
      "kind": "assign",
      "target": "x"
    },
    {
      "expression": {
        "kind": "intLiteral",
        "value": 2
      },
      "kind": "assign",
      "target": "y"
    },
    {
      "arguments": [],
      "delay": 1,
      "kind": "selfSend",
      "message": "step"
    }
  ],
  "family": "multiStorePayload",
  "messageServers": [
    {
      "body": [
        {
          "expression": {
            "kind": "stateVar",
            "name": "y"
          },
          "kind": "assign",
          "target": "x"
        },
        {
          "expression": {
            "kind": "stateVar",
            "name": "x"
          },
          "kind": "assign",
          "target": "y"
        },
        {
          "arguments": [],
          "delay": 1,
          "kind": "selfSend",
          "message": "step"
        }
      ],
      "name": "step",
      "parameters": [],
      "priority": null
    }
  ],
  "schemaVersion": 1,
  "stateVariables": [
    {
      "initialValue": 0,
      "name": "x"
    },
    {
      "initialValue": 0,
      "name": "y"
    }
  ]
}
