{
  "actorClass": "Selector",
  "actorName": "selector",
  "className": "Selector",
  "constructorBody": [
    {
      "expression": {
        "kind": "intLiteral",
        "value": 0
      },
      "kind": "assign",
      "target": "x"
    },
    {
      "expression": {
        "kind": "intLiteral",
        "value": 0
      },
      "kind": "assign",
      "target": "y"
    },
    {
      "arguments": [],
      "delay": 1,
      "kind": "selfSend",
      "message": "high"
    },
    {
      "arguments": [],
      "delay": 1,
      "kind": "selfSend",
      "message": "low"
    }
  ],
  "family": "multiStorePayload",
  "messageServers": [
    {
      "body": [
        {
          "expression": {
            "kind": "intLiteral",
            "value": 1
          },
          "kind": "assign",
          "target": "x"
        },
        {
          "arguments": [],
          "delay": 1,
          "kind": "selfSend",
          "message": "high"
        }
      ],
      "name": "high",
      "parameters": [],
      "priority": 1
    },
    {
      "body": [
        {
          "expression": {
            "kind": "intLiteral",
            "value": 1
          },
          "kind": "assign",
          "target": "y"
        },
        {
          "arguments": [],
          "delay": 1,
          "kind": "selfSend",
          "message": "low"
        }
      ],
      "name": "low",
      "parameters": [],
      "priority": 2
    }
  ],
  "schemaVersion": 1,
  "stateVariables": [
    {
      "initialValue": 0,
      "name": "x"
    },
    {
      "initialValue": 0,
      "name": "y"
    }
  ]
}
